{
  "$schema": "m12-sbom-inputs.v1.schema.json",
  "schemaVersion": 1,
  "manifestId": "m12-sbom-inputs",
  "roots": [
    "src/SqlObserver.Server/SqlObserver.Server.csproj",
    "src/SqlObserver.Collector/SqlObserver.Collector.csproj",
    "src/SqlObserver.McpStdio/SqlObserver.McpStdio.csproj"
  ],
  "files": [
    {
      "path": "Directory.Build.props",
      "sha256": "2a39c4516797245bbfdec3b55ccf11b50028bb6e3656e005eec8c2d5e46601d8"
    },
    {
      "path": "Directory.Packages.props",
      "sha256": "bf0b77d6b92b590b7945157a9dd5877a68a0ed1fb6969044c90e732f69ee978a"
    },
    {
      "path": "global.json",
      "sha256": "285a6b6549620a67b92fbd0f1b2ef176934afb80a87cf66e49527b607eac4de4"
    },
    {
      "path": "src/SqlObserver.Alerting/SqlObserver.Alerting.csproj",
      "sha256": "99b65575d049cf4c7f00c32a01829eff676bf3a7bbad13ab0b66942f8d0e1a83"
    },
    {
      "path": "src/SqlObserver.Alerting/packages.lock.json",
      "sha256": "023cc2c4278661751fa386518c7dc09d3c16c9ba7a61e9ddc3a1c4ee1b542d43"
    },
    {
      "path": "src/SqlObserver.Analytics/SqlObserver.Analytics.csproj",
      "sha256": "2959318a02016d5d2ea955f931e9071e051ed5f86a6dc6689a60eb097c754837"
    },
    {
      "path": "src/SqlObserver.Analytics/packages.lock.json",
      "sha256": "023cc2c4278661751fa386518c7dc09d3c16c9ba7a61e9ddc3a1c4ee1b542d43"
    },
    {
      "path": "src/SqlObserver.Application/SqlObserver.Application.csproj",
      "sha256": "05be1b9d6b195c13916e79f2178c0e9f54b266afe37b5116930fa9168679e31d"
    },
    {
      "path": "src/SqlObserver.Application/packages.lock.json",
      "sha256": "a7a24f315fd54f099efc675c7a28f15ba6901954e58e3c2793568ac705d162f2"
    },
    {
      "path": "src/SqlObserver.Audit/SqlObserver.Audit.csproj",
      "sha256": "052fe97b733bb405e52e04c79795096270746f6a213a1a47af3cb687f7f7de4a"
    },
    {
      "path": "src/SqlObserver.Audit/packages.lock.json",
      "sha256": "023cc2c4278661751fa386518c7dc09d3c16c9ba7a61e9ddc3a1c4ee1b542d43"
    },
    {
      "path": "src/SqlObserver.Collector/SqlObserver.Collector.csproj",
      "sha256": "0896fbf3a2b5bd0cfa6bf67ad8d89f6b78cb0c2de1dec4a225825fc3714c54d5"
    },
    {
      "path": "src/SqlObserver.Collector/packages.lock.json",
      "sha256": "4b7c3a47c0f0d00793255f0f83deb8e5842bd041935eebb6c4adfbc32420cfb6"
    },
    {
      "path": "src/SqlObserver.Collector.Abstractions/SqlObserver.Collector.Abstractions.csproj",
      "sha256": "d1231103fb0bff9b35c7b556d5b9b9c947bc2031167f75e8b63add0614df5fbb"
    },
    {
      "path": "src/SqlObserver.Collector.Abstractions/packages.lock.json",
      "sha256": "15776e833ac6f2a174dc3bdfbebc0c93533720cb69868694bc8df23c364091a8"
    },
    {
      "path": "src/SqlObserver.Collectors/SqlObserver.Collectors.csproj",
      "sha256": "493e8d927547e0685ca8cab46ec9902a76c3942c9950fc8f285547e39787a291"
    },
    {
      "path": "src/SqlObserver.Collectors/packages.lock.json",
      "sha256": "023cc2c4278661751fa386518c7dc09d3c16c9ba7a61e9ddc3a1c4ee1b542d43"
    },
    {
      "path": "src/SqlObserver.Domain/SqlObserver.Domain.csproj",
      "sha256": "746b4f8da0f5e08f1c3da291a17fb3d1e5da684a9bfe5fae0d5b8f1f69a1d02d"
    },
    {
      "path": "src/SqlObserver.Domain/packages.lock.json",
      "sha256": "03eeadc5ef377c17f787ab65f41fb4c8a9c936bb7f7f4171111fdeec8a81cb46"
    },
    {
      "path": "src/SqlObserver.Infrastructure.PostgreSql/SqlObserver.Infrastructure.PostgreSql.csproj",
      "sha256": "0aafe107efa720b60b3a354c35d2961ae3abd04490737b6b1413dd4e94b5af2c"
    },
    {
      "path": "src/SqlObserver.Infrastructure.PostgreSql/packages.lock.json",
      "sha256": "8e59cdd654f5c8f859219cb3c27a94915981e6dec3dec2f6048af724e22de3ec"
    },
    {
      "path": "src/SqlObserver.Infrastructure.SqlServer/SqlObserver.Infrastructure.SqlServer.csproj",
      "sha256": "2ffaf7fdaf57ded7d9183b0382a8aa5acc382522c81baebcc72ff9c0884f183a"
    },
    {
      "path": "src/SqlObserver.Infrastructure.SqlServer/packages.lock.json",
      "sha256": "e3fef6871ed4f48895a21481470e1cfd726402afbb33e5f336fb33773774458a"
    },
    {
      "path": "src/SqlObserver.Infrastructure.Windows/SqlObserver.Infrastructure.Windows.csproj",
      "sha256": "6f4964cf084185e97ab5f9be7fb2861a99f075af64334ae03a737123749624be"
    },
    {
      "path": "src/SqlObserver.Infrastructure.Windows/packages.lock.json",
      "sha256": "cdd70804a7d24f55062d3d2d36f1b14f39131e5cdf9c5c9e0f5b55485d7c83a9"
    },
    {
      "path": "src/SqlObserver.Mcp/SqlObserver.Mcp.csproj",
      "sha256": "26494916f5c2506f15b0390d389f8d883d5f66f0358ed51f062153b66da8ad2b"
    },
    {
      "path": "src/SqlObserver.Mcp/packages.lock.json",
      "sha256": "a4585b63397376a9c8fa11ebc133ef45c076f59168a001aeb26182e93e355172"
    },
    {
      "path": "src/SqlObserver.McpStdio/SqlObserver.McpStdio.csproj",
      "sha256": "a760a66ece468a9e0e39c027f69fd90a32bd295ffc3b842db93a103a00b61a1f"
    },
    {
      "path": "src/SqlObserver.McpStdio/packages.lock.json",
      "sha256": "c15c86f69ff56bd3d6ddbcc5ac4b02aaed9228f001f7592c4f59c633296d0eff"
    },
    {
      "path": "src/SqlObserver.Observability/SqlObserver.Observability.csproj",
      "sha256": "60576c36aab91800264f4e35c58943fded212a53c029a90171a87e897f0828c5"
    },
    {
      "path": "src/SqlObserver.Observability/packages.lock.json",
      "sha256": "9921a06f61fbd419a030273ecc8a58e96cffaf02bcf95e1c07088e62098b2468"
    },
    {
      "path": "src/SqlObserver.Reporting/SqlObserver.Reporting.csproj",
      "sha256": "a26bbe38ff99fba66f3ad5e77565e465868d59cd12bdc10e0876a26256208e63"
    },
    {
      "path": "src/SqlObserver.Reporting/packages.lock.json",
      "sha256": "15776e833ac6f2a174dc3bdfbebc0c93533720cb69868694bc8df23c364091a8"
    },
    {
      "path": "src/SqlObserver.Security/SqlObserver.Security.csproj",
      "sha256": "c0d0704997ecf50b3f48d2118fc01838abb08322507841a6753cff068958af64"
    },
    {
      "path": "src/SqlObserver.Security/packages.lock.json",
      "sha256": "023cc2c4278661751fa386518c7dc09d3c16c9ba7a61e9ddc3a1c4ee1b542d43"
    },
    {
      "path": "src/SqlObserver.Server/SqlObserver.Server.csproj",
      "sha256": "168a9680121046f74bc64e2baa9e4313ba4c8279bf3bde89762da30d6385be93"
    },
    {
      "path": "src/SqlObserver.Server/packages.lock.json",
      "sha256": "63f774474453eae1a14ebcecece996fcb4b8764064f4a47bd1eb01c79ee40f76"
    },
    {
      "path": "web/contracts/web-asset-manifest.v1.schema.json",
      "sha256": "1f1e5b785dde79c492773f7298074fbf4668a1cebe75764cecdf97983fed682a"
    },
    {
      "path": "web/package.json",
      "sha256": "8e5dbaa63777c7cd1ddd197a33b9e246b62d847738031878ddceeece3e95f30c"
    },
    {
      "path": "web/pnpm-lock.yaml",
      "sha256": "a92b23531a77abb7b6601808f4254f25b45353ead69f692d08ff71f27aa74bff"
    },
    {
      "path": "web/tools/web-asset-manifest.mjs",
      "sha256": "2fd70c625aff7f5cb77422f1efef3cc674061f91a57e1a93853938f52bf42bf0"
    }
  ]
}
